{
  "project_id": "case06-project",
  "rights_status": "owned_original",
  "adaptation_mode": "balanced",
  "genre_mode": "wuxia_action",
  "aspect_ratio": "9:16",
  "target_medium": "ai_animation",
  "source_gaps_or_contradictions": [],
  "debt_ledger": [
    {
      "debt_id": "debt-01",
      "origin_ep": "EP01",
      "payoff_ep": "EP02",
      "debtor": "lin-che",
      "description": "林澈隱瞞信件背面字跡，引來沈寧懷疑",
      "status": "open"
    }
  ],
  "episodes": [
    {
      "episode_id": "EP01",
      "title": "測試集",
      "target_duration_seconds": 20,
      "episode_goal": "推進核心衝突並驗證連戲",
      "act_out_type": "revelation_twist",
      "scenes": [
        {
          "project_id": "case06-project",
          "episode_id": "EP01",
          "scene_id": "EP01-S01",
          "source_refs": [
            "ch06:u1_fight"
          ],
          "adaptation_mode": "balanced",
          "setting": {
            "location": "old_apartment",
            "time": "night",
            "interior": true,
            "timeline_tag": "present"
          },
          "characters": [
            "lin-che",
            "zhao-kun"
          ],
          "scene_goal": "將暴雨背景與燒信抉擇外化為火盆與紅章信封動作",
          "dramatic_turn": "信紙受熱浮現陌生字跡且沈寧已在門外",
          "dialogue": [
            {
              "speaker": "shen-ning",
              "text": "開門。我知道你看過那封信。",
              "audio_type": "offscreen"
            },
            {
              "speaker": "lin-che",
              "text": "這字……不是我寫的。",
              "audio_type": "onscreen"
            }
          ],
          "props": [
            "wet_letter",
            "brazier"
          ],
          "continuity_initial": {
            "wet_letter": "on_table"
          },
          "continuity_final": {
            "wet_letter": "in_lin_che_hand"
          },
          "estimated_duration_seconds": {
            "min": 14,
            "max": 23
          },
          "adaptation_changes": [
            {
              "type": "compress",
              "description": "將暴雨停擺與礦難心理獨白壓縮為『南岸礦務』紅章與火盆燒信動作",
              "source_ref": "ch01:u1"
            }
          ],
          "storyboard_handoff": {
            "recommended_generation_modes": [
              "FL2V",
              "I2V"
            ],
            "required_visual_beats": [
              "鐵爪破袖滲血",
              "短刀卡入關節折斷寒光",
              "奪回油布帳冊定格"
            ],
            "required_audio_beats": [
              "金屬崩裂聲",
              "雨水落地聲"
            ],
            "must_preserve": [
              "左袖受傷與短刀折斷的戰術代價"
            ],
            "production_risk": {
              "level": "high",
              "reason": "雙人近身兵刃交擊直接生成易穿模",
              "original_vision": "雙人全身纏鬥十招奪冊",
              "simplified_alternative": "拆為三鏡：①趙坤突刺起手(I2V) -> ②刀刃卡住鐵爪崩斷特寫(FL2V) -> ③林澈接住帳冊、趙坤捂手後退結果(I2V)"
            }
          }
        }
      ]
    }
  ]
}